{
  "$schema": "https://json-schema.org/draft/2020-12/schema",
  "$id": "https://orchestra.dev/schemas/workflow-definition.json",
  "title": "OrchestraWorkflowDefinition",
  "description": "Declarative Directed Acyclic Graph (DAG) workflow definition.",
  "type": "object",
  "required": [
    "schema_version",
    "id",
    "version",
    "name",
    "description",
    "tier",
    "steps",
    "acceptance_criteria"
  ],
  "additionalProperties": false,
  "properties": {
    "schema_version": {
      "type": "string",
      "pattern": "^1\\.[0-9]+\\.[0-9]+$"
    },
    "id": {
      "type": "string",
      "pattern": "^[a-z0-9_-]+$"
    },
    "version": {
      "type": "string",
      "pattern": "^[0-9]+\\.[0-9]+\\.[0-9]+$"
    },
    "name": {
      "type": "string",
      "minLength": 1
    },
    "description": {
      "type": "string",
      "minLength": 10
    },
    "tier": {
      "type": "string",
      "enum": ["Tiny", "Normal", "Complex", "Architectural"]
    },
    "inputs": {
      "type": "object",
      "additionalProperties": { "type": "string" }
    },
    "outputs": {
      "type": "object",
      "additionalProperties": { "type": "string" }
    },
    "steps": {
      "type": "array",
      "minItems": 1,
      "items": {
        "type": "object",
        "required": [
          "id",
          "name",
          "agent_role"
        ],
        "additionalProperties": false,
        "properties": {
          "id": {
            "type": "string",
            "pattern": "^[a-z0-9_-]+$"
          },
          "name": { "type": "string" },
          "description": { "type": "string" },
          "agent_role": {
            "type": "string",
            "enum": ["orchestra", "researcher", "advisor", "tester", "reviewer", "worker"]
          },
          "required_skills": {
            "type": "array",
            "items": { "type": "string" }
          },
          "dependencies": {
            "type": "array",
            "items": { "type": "string" },
            "default": []
          },
          "target_files": {
            "type": "array",
            "items": { "type": "string" }
          },
          "verification_command": { "type": "string" },
          "timeout_seconds": { "type": "integer", "minimum": 1, "default": 180 },
          "retry_limit": { "type": "integer", "minimum": 0, "default": 2 },
          "approval_gate": { "type": "boolean", "default": false },
          "budget_fraction": { "type": "number", "minimum": 0.0, "maximum": 1.0 },
          "preconditions": {
            "type": "array",
            "items": { "type": "string" }
          },
          "postconditions": {
            "type": "array",
            "items": { "type": "string" }
          }
        }
      }
    },
    "acceptance_criteria": {
      "type": "array",
      "items": { "type": "string" },
      "minItems": 1
    },
    "budget_profile": {
      "type": "string",
      "enum": ["Tiny", "Normal", "Complex", "Architectural"]
    }
  }
}
